"Siena University",,,,,,,,,,,,,,,
"Prof Chaudhary did an outstanding job with this class. He is knowledgeable, explains things clearly, and has unparalleled enthusiasm. He kept the class engaged, and it was an excellent learning experience. All of his demos made it really fun and interactive. And working in groups with other students was surprisingly helpful.",,,,,,,,,,,,,,,
Honestly for a level 100 class it was very difficult since im not a computer scientist major but if there was less work it would have been better as therr are more important classes for my major that i am currently taking,,,,,,,,,,,,,,,
Professor Chaudhari was always available for questions outside the classroom. He always gave useful feedback and was very very enthusiastic about the course material while teaching.,,,,,,,,,,,,,,,
Chanduri is a great guy. Always available and ALWAYS challenged me to work hard. ,,,,,,,,,,,,,,,
Homeworks were mostly confusing and could've been simplified in a different way. ,,,,,,,,,,,,,,,
Labs always go well and gives us a chance to really learn the material.,,,,,,,,,,,,,,,
"Professor Chaudhari is single-handedly the future of this college. I wish every professor I had not only had the enthusiasm, compassion, and willingness for the subject they teach, but also for their students. There’s never a dull moment with him. It’s so clear he cares about what he does and it honestly is refreshing. ",,,,,,,,,,,,,,,
Professor Chaudhari is by far one of my favorite professors. ,,,,,,,,,,,,,,,
Good prof.,,,,,,,,,,,,,,,
"Solid professor, knows how to teach.",,,,,,,,,,,,,,,
"Always energetic, and enjoys teaching students about something he is passionate about. Created a good atmosphere and made class interesting",,,,,,,,,,,,,,,
n/a,,,,,,,,,,,,,,,
"Professor Chaudhari is a great professor. You can really tell that he loves what he does and is extremely knowledgeable in subjects relating to computer science. He was also extremely flexible and understanding, something that I feel is important and rare to find in professors at this institution. ",,,,,,,,,,,,,,,
Professor C is a great professor who is very enthusiastic about the subject and goes above and beyond in order for his students to succeed. My only thing is I think he could do a better job of being more organized it seems he comes to lectures a bit unprepared but other than that he is amazing ,,,,,,,,,,,,,,,
Labs were made in a fun way to help learn the material. They were challenging at times in a good way. He was very helpful in helping us understand and learn during the labs.,,,,,,,,,,,,,,,
Very Passionate about teaching. Made learning computer science fun and enjoyable. I always looked forward to coming and learning from him.,,,,,,,,,,,,,,,
"I truly appreciate you never giving up on students like myself, youre efforts to show you care make everything much better. Although struggling knowing you were on my team made me more hopeful!",,,,,,,,,,,,,,,
Thank you ! Your energy is great for this type of course,,,,,,,,,,,,,,,
Prof. Chaudhari is by far one of the mot enthusiastic professors I have ever had. His clear enjoyment of the course material is contagious and compelling. He employs many styles of teaching and presenting that are outside of the box and it encouraged me to carry that mentality into each lesson and assignment.,,,,,,,,,,,,,,,
"This teacher is incredibly enthusiastic and very clearly loves what he does and what he's teaching. I appreciated that. He cares about his students. He can be a little heavy on the work-load, which was solely difficult due to my inability to attend all classes, but he was very accommodating and helpful when it came to making it up.",,,,,,,,,,,,,,,
Professor Chaudhari was extremely helpful and available outside of class when students are struggling or need help. ,,,,,,,,,,,,,,,
"When the professor saw that I was struggling or needed help, he would reach out to me and ask me to sit down with him to help me understand my work more.",,,,,,,,,,,,,,,
Great professor all around.,,,,,,,,,,,,,,,
was available during office hours,,,,,,,,,,,,,,,
was available during office hours,,,,,,,,,,,,,,,
"He was pretty cool. He answered emails pretty quick, usually at strange times in the night -- but he answered. ",,,,,,,,,,,,,,,
Professor C really improved my listening skills because he gets snappy when you're not looking at him.,,,,,,,,,,,,,,,
Prof C did a wonderful job teaching the course and was very accessible outside of class if there was anything that was a struggle. He is very enthusiastic and helpful.,,,,,,,,,,,,,,,
Professor C is really awesome and obviously cares about his students. I would 100% try to take more classes with him. ,,,,,,,,,,,,,,,
"An overall good lab teacher, I had a good time and learned a lot.",,,,,,,,,,,,,,,
"Just a really good instructor, being enthusiastic about the topic is essential in order to teach it well. Overall had a great time ",,,,,,,,,,,,,,,
Ninad was always willing to meet and was super helpful during meetings.,,,,,,,,,,,,,,,
"Great professor, doesn’t always make teachings clear at first but is always willing to help you understand. Great character and a good friend. ",,,,,,,,,,,,,,,
Professor Chaudhari was a great professor and cared very deeply about his students and their success,,,,,,,,,,,,,,,
Professor Chaudhari was a great professor and showed great care for his students ,,,,,,,,,,,,,,,
felt very fast paste,,,,,,,,,,,,,,,
Prof. Chaudhari is awesome and keeps me interested even when it's super early in the morning. I find myself not watching the clock as I like learning about the subject and I like the way he teaches.,,,,,,,,,,,,,,,
"Super cool, very helpful and makes you realize what you're doing wrong and how to fix it without just telling you. Definitely makes the content easier to understand.",,,,,,,,,,,,,,,
"Professor C was a very great professor. If anything he ever said was confusing during a lecture or lab, meeting with him during office hours allowed you to hear it one on one and made it easier to follow.",,,,,,,,,,,,,,,
Professor C was an amazing professor. Very enthusiastic about every lecture and extremely helpful outside of class when questions came up. ,,,,,,,,,,,,,,,
A really great person as well as instructor that helped me grow as a student. ,,,,,,,,,,,,,,,
Was a really great professor and I enjoyed taking class with him this semester. ,,,,,,,,,,,,,,,
My favorite professor so far here at Siena!!,,,,,,,,,,,,,,,
Very good professor,,,,,,,,,,,,,,,
He was the best. Helped whenever we needed it. Went through each step clearly.,,,,,,,,,,,,,,,
"Mr Chaudhari is a bright,enthusiastic, professor who wants nothing but the best for his students. He values education deeply and is committed to making sure everyone understands the material. He treats his students with kindness and values them as human beings. He is also a very accessible professor who utilizes many forms of communication with his students.",,,,,,,,,,,,,,,
"The class was incredible, and you made it so much more fun too.",,,,,,,,,,,,,,,
Professor is a very good professor not just in class but also especially outside of class especially when I was concerned what I should do after college,,,,,,,,,,,,,,,
He was extremely helpful and supportive.,,,,,,,,,,,,,,,
he's amazing.,,,,,,,,,,,,,,,
He really seems to enjoy teaching the class and every day when I come i'm very excited to be here. He's definitely a 10/10 teacher,,,,,,,,,,,,,,,
"Lab was extremely similar to class, energetic and a lot to learn. ",,,,,,,,,,,,,,,
This was probably the best instructor I could have had for computer science. Did a course at Hudson Valley and they were arrogant and terrible so it was quite pleasant to see a major switch in behavior and teaching methods. ,,,,,,,,,,,,,,,
goat professor,,,,,,,,,,,,,,,
Was really enthusiastic and passionate about the course. As available outside of class as possible and helpful and understanding during those times. Wants the best for his students. 10/10,,,,,,,,,,,,,,,
Question: What instructor did well,,,,,,,,,,,,,,,
He flew around the room at lightning speed to get to everyone and was constantly interacting with students. Helped point things out without solving the problems for us.,,,,,,,,,,,,,,,
Definitely pushed me to think individually and find my own solutions,,,,,,,,,,,,,,,
It felt like we held conversations in class instead of just getting a bunch of slide information definitely made the teacher and student connection stronger and less of a power dynamic ,,,,,,,,,,,,,,,
"Encouraged group work within the classroom, which encouraged different perspectives and ways of thinking.",,,,,,,,,,,,,,,
In-class examples and going through together. ,,,,,,,,,,,,,,,
Lab's helped apply to skills the best and Chanduri was always there when needed for clarification. ,,,,,,,,,,,,,,,
Each lab defined the material more,,,,,,,,,,,,,,,
The instructor showed his happiness around the subject and how much he knew daily.,,,,,,,,,,,,,,,
"He doesnt just show you how to do it. He guides, and ensures you understand. And if you dont understand, he doesnt just regurgitate what he said before, he rewords and rephrases and tries a new way to help you learn. He has immense awareness for peoples different styles of learning. ",,,,,,,,,,,,,,,
"Was always available to email, or meet no matter what. His flexibility regarding working with students outside of class is by far unmatched by anyone else ",,,,,,,,,,,,,,,
Good lectures involving students.,,,,,,,,,,,,,,,
"Printouts, each class the students would be involved.",,,,,,,,,,,,,,,
He would circle the room when we needed help with labs. Make sure we all knew why something worked the way it did. ,,,,,,,,,,,,,,,
Went over slides and made sure there were no major questions,,,,,,,,,,,,,,,
Professor C was extremely enthusiastic about teaching this class and is obviously extremely knowledgeable about his subject. ,,,,,,,,,,,,,,,
The interactive lesions as well as going through each problem step by step. ,,,,,,,,,,,,,,,
Helped outside of class time,,,,,,,,,,,,,,,
helped with labs but did not give the answer when struggling ,,,,,,,,,,,,,,,
extremely enthusiastic about teaching and a very kind and helpful person,,,,,,,,,,,,,,,
very encouraging of everyone to do their best work and flexible to make sure i understood what was being asked of me. one of my favorite instructors i've had at Siena.,,,,,,,,,,,,,,,
Was always open to help outside the class,,,,,,,,,,,,,,,
Instructor uploaded notes and had outside resources ,,,,,,,,,,,,,,,
Helped when questions were asked. Didn’t give us the answers but helped us under how to get the answers ourselves and better understand the material.,,,,,,,,,,,,,,,
Helped us answer questions and solve problems in a way that helped us learn and understand while still challenging us to do our best.,,,,,,,,,,,,,,,
"Prof. Chaudhari was always willing to work through a problem with me, but would ensure that I was the one solving it. There was a absolutely a guidance but he made sure in the end I figured it out on my own merits which helped me deepen my understanding of the concepts.",,,,,,,,,,,,,,,
He was accommodating and made sure to give as much feedback as he possibly could.,,,,,,,,,,,,,,,
His flexible office hours helped me greatly in this course. His encouragement and willingness to help is the reason I am doing so well in this course ,,,,,,,,,,,,,,,
The instructor made the class environment extremely welcoming and fun and was always open to questions. ,,,,,,,,,,,,,,,
His accessibility and his want to help people improve and succeed ,,,,,,,,,,,,,,,
His accessibility and will reach out to you if he notices you are struggling.,,,,,,,,,,,,,,,
Held a lot of open office hours.,,,,,,,,,,,,,,,
Broke concepts down for me ,,,,,,,,,,,,,,,
Gave real life examples ,,,,,,,,,,,,,,,
comminicated clearly,,,,,,,,,,,,,,,
employed hands on learning experiences,,,,,,,,,,,,,,,
"He dressed nice, so made me take him seriously. ",,,,,,,,,,,,,,,
He was enthusiastic. ,,,,,,,,,,,,,,,
Didn't just give the answer but helped me figure out how to get to the correct solution,,,,,,,,,,,,,,,
Working through the problem together rather than just giving a solution.,,,,,,,,,,,,,,,
The instructor was very good at meeting with people individually and answering questions.,,,,,,,,,,,,,,,
Visual representations of the code helped a lot,,,,,,,,,,,,,,,
He was always open to meet and help with anything. ,,,,,,,,,,,,,,,
Made class interactive,,,,,,,,,,,,,,,
Always helps when asked,,,,,,,,,,,,,,,
Always willing to put as much time and effort into helping you as he could. Would really help you understand rather than just telling you what to do. ,,,,,,,,,,,,,,,
"Professor Chaudhari is the best. I also think that he is a favorite around campus, but don't get anything mixed up. The course and the work is difficult and he doesn't give freebees. He makes you work thoroughly and motivates you to do the best you can possibly do. As a communications major, I was put into computer science for a requirement knowing nothing of the subject. Ninad guided me through the course, with responding to emails ASAP and even in the middle of the night, to having office hours 4/5 days a week. Not only was he this engaged with me, he was with every student. I recommend for him to become an advisor or something because he truly can relate to the college youth. ",,,,,,,,,,,,,,,
"Professor Chaudhari was by far the most engaging, understanding and helpful professor I had this semester. He held office hours 4/5 days of the week that allowed me to learn the material even better, and he answered his email 24/7. I don't know if I would have been able to get through this course without his great teaching and guidance. ",,,,,,,,,,,,,,,
He was great at pacing the lesson so that everyone got it,,,,,,,,,,,,,,,
Very good at pacing the lesson so that everyone understood it,,,,,,,,,,,,,,,
He kinda had fun with it but kinda confusing sometimes ,,,,,,,,,,,,,,,
The way he explains the topics is easy to understand and his office hours are very helpful.,,,,,,,,,,,,,,,
"Professor C was extremely helpful no matter what the circumstance. Would give me an extension if an assignment was giving me trouble, help me in office hours, and checked over any of my work when I wanted to make sure I was doing it correctly. ",,,,,,,,,,,,,,,
Professor C would always draw diagrams which was extremely helpful for visual learners.,,,,,,,,,,,,,,,
The instructor was really passionate about this subject and it kept me engaged as a student which helped me learn.,,,,,,,,,,,,,,,
Was very passionate about what he was teaching and it kept me engaged entirely.,,,,,,,,,,,,,,,
Helped when we needed help,,,,,,,,,,,,,,,
"Was free outside of class time, and provided many different ways of communicating ",,,,,,,,,,,,,,,
Asked questions and went around to everyone to make sure they weren't stuck on something.,,,,,,,,,,,,,,,
Explained things nicely in an enthusiastic tone.,,,,,,,,,,,,,,,
Going through each step,,,,,,,,,,,,,,,
He went through the whole process of an assignment. Not just giving us the answer. ,,,,,,,,,,,,,,,
Help outside of the office hours was a big help.,,,,,,,,,,,,,,,
"He pushed me to learn and understand things for myself, while answering any questions I had.",,,,,,,,,,,,,,,
Tried to push me to figure an answer out myself. Answered my questions when I needed help. Helped me fix mistakes on my homework. ,,,,,,,,,,,,,,,
Mr. C included started code within the labs to give his students a heads tart to completing and understanding the lab. He also made sure that lab partners changed for each lab so we got to work with different people.,,,,,,,,,,,,,,,
"The instructor was able to relay computer science concepts in a way which could be understood by beginner computer science students. He also excelled in personal student assistance. When a student asked him for help, he did not simply give them an answer but rather he gave them clues for the student to get the answer themselves.",,,,,,,,,,,,,,,
Had good class discussions,,,,,,,,,,,,,,,
"Had good class discussions, and also explained things very well if you did not understand it, very enthusiastic and will help you no matter what",,,,,,,,,,,,,,,
he gave very clear directions and gives enough time to work on assignment and he walks around the lab to make sure everyone is okay and on the same pace,,,,,,,,,,,,,,,
"he was very easy to contact with, he usually answers his emails very quickly and has flexible office hours and meeting times",,,,,,,,,,,,,,,
He printed out the slides so I can take notes ,,,,,,,,,,,,,,,
He was very great to get in contact with and get help with any issue i am expiring. ,,,,,,,,,,,,,,,
"I didn't feel like I had to rush, he said i don't care if it's late as long as the assignment is complete and you don't give up.",,,,,,,,,,,,,,,
Flexible office hours and open to conversation outside of them,,,,,,,,,,,,,,,
Repetition,,,,,,,,,,,,,,,
He taught the subject really simple at first and then applied more complicated concepts throughout the course.,,,,,,,,,,,,,,,
He was always very enthusiastic and very willing to help figure out errors.,,,,,,,,,,,,,,,
He was very enthusiastic every class about the topic(s) we were learning.,,,,,,,,,,,,,,,
He was very patient. He would take the time to address any student's issues and concerns. He was an excellent instructor.,,,,,,,,,,,,,,,
My instructor helped me understand exactly where I was having difficulties and explained the content with a well-structured foundation. He also always reviewed the material to make sure nothing was missing.,,,,,,,,,,,,,,,
Clearly communicated the learning material.,,,,,,,,,,,,,,,
He explained things in a way that was easy to understand and was willing to offer help when asked.,,,,,,,,,,,,,,,
Explain topics slowly,,,,,,,,,,,,,,,
"Aided when we were lost, gave us time to figure it out ourselves. ",,,,,,,,,,,,,,,
He taught the material and explained how it would work and why it would work on the computer. He also had us sit and think so we had a lot of opportunities to figure it out ourselves. ,,,,,,,,,,,,,,,
"Always open to help or support through office hours. Not a harsh grader, but pushes you to do your best.",,,,,,,,,,,,,,,
Took the time to explain concepts and always advertised office hours/coming in for help. Very enthusiastic. Encourages class participation.,,,,,,,,,,,,,,,
Made me come to answers on my own during office hours instead of just telling me them,,,,,,,,,,,,,,,
Question: How to improve interactions with students,,,,,,,,,,,,,,,
"Honestly, can't think of anything. Did a great job establishing an atmosphere of mutual respect that felt unintimidating.",,,,,,,,,,,,,,,
Nothing I can think of!,,,,,,,,,,,,,,,
I don’t think there is much that can be done ,,,,,,,,,,,,,,,
"Not much, super enthusiastic and open to conversation. ",,,,,,,,,,,,,,,
N/A,,,,,,,,,,,,,,,
N/A,,,,,,,,,,,,,,,
He interacted well. Very enthusiastic about the class as a whole.,,,,,,,,,,,,,,,
He interacts well and makes sure were doing good each lab.,,,,,,,,,,,,,,,
Honestly during labs there needs to be a better method of getting help. He needs a lab assistant cause it takes up a lot of time waiting. ,,,,,,,,,,,,,,,
Refer to the lab evaluation. ,,,,,,,,,,,,,,,
Keep it up.,,,,,,,,,,,,,,,
Same thing.,,,,,,,,,,,,,,,
n/a ,,,,,,,,,,,,,,,
nothing,,,,,,,,,,,,,,,
n/a,,,,,,,,,,,,,,,
N/A,,,,,,,,,,,,,,,
let us keep the same lab partners ,,,,,,,,,,,,,,,
More group activities,,,,,,,,,,,,,,,
he was always eager to help and was a very good professor to have,,,,,,,,,,,,,,,
i thought the instructor was always respectful and encouraging,,,,,,,,,,,,,,,
Maybe be a bit better with emails,,,,,,,,,,,,,,,
Maybe give video lectures or in depth notes to how to code better ,,,,,,,,,,,,,,,
I already believe that Prof. Chaudhari is great with student interactions. His excitement and energy towards the course can really break you out of your shell and make you more comfortable. I understand that this isn't helpful for improvements but I have no improvement s to suggest.,,,,,,,,,,,,,,,
His enthusiasm was enough to make any interaction worth the effort.,,,,,,,,,,,,,,,
N/A,,,,,,,,,,,,,,,
"Explain how we messed up in the lab when we ask him to check over our work, rather than just saying it is wrong. ",,,,,,,,,,,,,,,
"Nothing, he already does a great job",,,,,,,,,,,,,,,
Give a helpful answer not a riddle in lab ,,,,,,,,,,,,,,,
made more personal connections with students,,,,,,,,,,,,,,,
nothing,,,,,,,,,,,,,,,
HE CAN STOP SHOUTING "HELLO!!!!!!" PLEASE PLEASE PLEASE PLEASE PLEASE STOP ITS 8AM.,,,,,,,,,,,,,,,
"Maybe be a bit better at going around in labs, he sorta focuses on one group. In class, he's pretty cool just calls on kids that don't know the answer a lot.",,,,,,,,,,,,,,,
"Not much, there were many group-work opportunities and we always shuffled lab partners, so it was hard not to make a friend.",,,,,,,,,,,,,,,
"Not much, there were many times we did group work and it was hard not to have a buddy in the class for when you were confused.",,,,,,,,,,,,,,,
I don't know. Student interactions was his greatest strength,,,,,,,,,,,,,,,
"Student interaction was his main strength, so I don't know.",,,,,,,,,,,,,,,
Be a little more thorough with teachings without being asked,,,,,,,,,,,,,,,
He does great,,,,,,,,,,,,,,,
Nothing he was one of the best professors I have had. ,,,,,,,,,,,,,,,
None,,,,,,,,,,,,,,,
None,,,,,,,,,,,,,,,
Go slower make sure we understand ,,,,,,,,,,,,,,,
"Nothing, I think the interactions w/ students are very helpful and he is easy to talk to.",,,,,,,,,,,,,,,
N/A,,,,,,,,,,,,,,,
N/A,,,,,,,,,,,,,,,
"Maybe a little bit more in class activities, like writing on the whiteboards.",,,,,,,,,,,,,,,
Possibly do more group work in class.,,,,,,,,,,,,,,,
Nothing,,,,,,,,,,,,,,,
"Nothing, it was perfect",,,,,,,,,,,,,,,
Did a good job. ,,,,,,,,,,,,,,,
They do a good job. ,,,,,,,,,,,,,,,
Maybe go slower ,,,,,,,,,,,,,,,
allow a new lab partner each week was a great way. ,,,,,,,,,,,,,,,
Maybe allow to choose lab partners some weeks,,,,,,,,,,,,,,,
"Mr C is eccentric which is a strength to his student engagement but it could also be a weakness. Some students may be shy or antisocial, repelling them away from his high energy.He must evaluate the student he is talking to and adjust his energy accordingly.",,,,,,,,,,,,,,,
Mr Chaudhari's eccentric personality is a strength to keep some students engaged however it may draw other students away. He needs to recognize the population of his class and change his tone accordingly,,,,,,,,,,,,,,,
I he does well and his best to interact with students and it is very effective. But sometimes it is a little difficult to understand due to his accent but overall he is good at communication. ,,,,,,,,,,,,,,,
maybe use another python software instead of juicemind ,,,,,,,,,,,,,,,
Nothing ,,,,,,,,,,,,,,,
he did a great job on trying to get students to work together.,,,,,,,,,,,,,,,
nothing he did an amazing job.,,,,,,,,,,,,,,,
No answer he makes himself easy to access and very approachable ,,,,,,,,,,,,,,,
Honestly he's perfect. Very energetic and upbeat every time,,,,,,,,,,,,,,,
I can’t think of anything he could do better.,,,,,,,,,,,,,,,
N/A,,,,,,,,,,,,,,,
I don't think anything should be done differently. He has a very welcoming environment and is very approachable.,,,,,,,,,,,,,,,
Not sure. I didn't run into any issues in this area.,,,,,,,,,,,,,,,
Unsure,,,,,,,,,,,,,,,
Nothing,,,,,,,,,,,,,,,
"Nothing, interaction depended on if students wanted to interact or not.",,,,,,,,,,,,,,,
"Probably nothing, he was enthusiastic and interacted a lot, it just depended if the students were in a mood to interact back. It was a morning class so not that many people want to talk of course. ",,,,,,,,,,,,,,,
Nothing that I can think of.,,,,,,,,,,,,,,,
Nothing that I can think of.,,,,,,,,,,,,,,,
Question: How instructor can improve course,,,,,,,,,,,,,,,
"It's an awesome course. Two minor things: 1. Get set up for lecture a few minutes in advance so that class starts on time 2. Give students a little more leeway to work through things on their own instead of stepping through each step of a long process as a class (sometimes when you call on someone and it seems like they're not paying attention, they are just focused on trying to understand or work through the problem on their own)",,,,,,,,,,,,,,,
Nothing obvious - it's a great course!,,,,,,,,,,,,,,,
Less homework,,,,,,,,,,,,,,,
Maybe some more activities in class to further help understand topics ,,,,,,,,,,,,,,,
Nothing,,,,,,,,,,,,,,,
Labs were good and effective. ,,,,,,,,,,,,,,,
SLOW DOWN. ,,,,,,,,,,,,,,,
Each student pays thousands of dollars for this school. Don't be so hard on attendance especially when they are still doing the work. ,,,,,,,,,,,,,,,
Teaches it well,,,,,,,,,,,,,,,
Make the textbook mandatory. ,,,,,,,,,,,,,,,
Make the textbook mandatory. I feel like a lot of things would be improved if the textbook was mandatory. ,,,,,,,,,,,,,,,
Keep it going.,,,,,,,,,,,,,,,
Keep it up.,,,,,,,,,,,,,,,
"It became a lot to have a lot of groups asking questions, I enjoyed the feedback and check with the instructor part of the labs however it did set us back sometimes. Maybe if there was a thing on top of the computers that could be raised if we need a check. Like a mailbox when there would be mail in it, a little flag to indicate we need to get a part checked but we will move on until then ",,,,,,,,,,,,,,,
"nothing, he made it really interesting and kept us all engaged",,,,,,,,,,,,,,,
n/a,,,,,,,,,,,,,,,
N/A,,,,,,,,,,,,,,,
during class time teach and prepares more for the lab rather than doing other activities,,,,,,,,,,,,,,,
Not so many note sheets at the begging of class,,,,,,,,,,,,,,,
