"Siena University",,,,,,,,,,,,,,,
"There were: 515 possible respondents.",,,,,,,,,,,,,,,
Order,Question Text,N,Avg,SD,CSIS Avg,School Avg,Siena Avg,Str Disagree,Disagree,Some Disagree,Neither,Some Agree,Agree,Str Agree,Neutral
1,Completed assigned work before class,395,6.00,1.25,6.31,6.36,6.37,1%,2%,4%,3%,14%,33%,43%,1%
1,Instructor communicated subject clearly,391,6.20,1.05,6.02,6.00,6.08,1%,1%,2%,1%,13%,34%,48%,0%
2,Student came prepared for class,393,6.23,1.02,6.33,6.32,6.35,1%,0%,2%,3%,10%,35%,49%,0%
2,Instructor enthusiastic about subject,392,6.87,0.54,6.40,6.46,6.50,1%,0%,0%,0%,0%,9%,90%,0%
3,Student contributed to class discussions,391,5.81,1.16,5.81,5.79,5.92,1%,1%,1%,11%,20%,32%,33%,1%
3,Instructor created respectful atmosphere,393,6.60,0.77,6.38,6.37,6.40,1%,0%,0%,1%,5%,22%,70%,0%
4,Instructor available outside class,392,6.60,0.82,6.24,6.23,6.23,1%,0%,1%,1%,3%,23%,69%,2%
5,Instructor gave useful feedback,392,6.44,0.88,6.10,6.02,6.06,1%,1%,0%,1%,7%,33%,58%,0%
6,Student challenged to do best work,392,6.62,0.76,6.14,6.17,6.17,1%,1%,0%,1%,2%,25%,71%,0%
,,,,,,,,Str Disagree,Disagree,Some Disagree,Neither,Some Agree,Agree,Str Agree,Neutral
6,Critical/ creative thinking improved,135,6.28,0.92,6.25,6.02,6.05,1%,0%,0%,4%,10%,37%,48%,1%
7,Research skills developed further,135,5.92,1.11,5.75,5.73,5.77,1%,0%,1%,10%,16%,31%,33%,9%
,,,,,,,,Str Disagree,Disagree,Some Disagree,Neither,Some Agree,Agree,Str Agree,Neutral
8,Sought instructor help when needed,388,6.20,1.05,6.08,5.99,5.97,0%,1%,1%,4%,10%,32%,48%,3%
,,,,,,,,Str Disagree,Disagree,Some Disagree,Neither,Some Agree,Agree,Str Agree,Neutral
8,Able to integrate information/ make reasoned judgements,135,5.94,1.07,5.96,5.85,5.92,1%,0%,1%,7%,17%,33%,33%,8%
9,Enhanced ability to read/ comprehend texts,134,5.77,1.12,5.71,5.62,5.91,0%,1%,1%,12%,16%,28%,26%,16%
10,More confident in communication skills,134,5.65,1.18,5.48,5.50,5.73,0%,1%,0%,20%,11%,28%,25%,15%
11,Improved listening ability,134,6.07,0.92,5.94,5.89,5.98,0%,0%,0%,6%,17%,33%,36%,8%
12,Can employ concepts of skepticism/ empiricism,134,5.60,1.18,5.60,5.61,5.64,1%,1%,0%,15%,15%,30%,19%,19%
13,Better able to apply quantitative skills,134,5.80,1.10,5.96,5.89,5.61,1%,0%,0%,13%,18%,34%,28%,6%
14,Improved ability to form hypotheses/ make reasoned judgements,134,5.85,1.21,5.84,5.86,5.76,1%,0%,1%,10%,14%,31%,31%,13%
15,Course allowed exploration of diversity/ inclusion,133,4.96,1.49,4.74,4.86,5.77,2%,2%,0%,23%,4%,17%,8%,44%
16,Self awareness of biases toward others,133,5.08,1.50,4.92,4.96,5.65,2%,1%,0%,21%,3%,17%,10%,46%
17,Understand duty to affirm rights of others,132,5.66,1.31,5.35,5.38,5.92,1%,1%,0%,14%,3%,23%,17%,42%
18,Course allowed exploration of traditions in history,133,4.88,1.50,4.76,4.80,5.69,2%,2%,0%,23%,4%,12%,9%,48%
19,Can show how traditions address humanistic/ religious questions,133,4.97,1.43,4.73,4.79,5.57,2%,1%,1%,23%,4%,14%,9%,47%
20,Can identify own traditions with others when presenting a position,133,4.99,1.46,4.80,4.86,5.59,2%,1%,2%,22%,5%,13%,10%,47%
21,Course allowed exploration of social justice concepts,133,4.99,1.42,4.75,4.85,5.74,2%,1%,0%,23%,5%,13%,9%,48%
22,Can apply social justice principles to learn extent they are unrealized,133,5.01,1.45,4.80,4.88,5.63,2%,1%,1%,22%,5%,13%,10%,48%
23,Can recognize underlying factors in social injustice,133,5.06,1.41,4.80,4.90,5.67,2%,1%,0%,20%,8%,12%,10%,48%
24,Course allowed exploration/ application of scientific method,132,5.64,1.14,5.58,5.87,5.36,0%,0%,0%,16%,8%,22%,17%,36%
25,Appreciation of link between nature/ effect of human involvement,132,5.37,1.24,5.00,5.66,5.52,0%,0%,1%,20%,5%,15%,13%,46%
26,Able to communicate benefits of good stewardship,132,5.29,1.15,5.18,5.57,5.61,0%,0%,0%,22%,8%,18%,11%,41%
,,,,,,,,,,,,,,,
Text Responses,,,,,,,,,,,,,,,
Question: Feedback on student effort,,,,,,,,,,,,,,,
procrastination got the better of me. ,,,,,,,,,,,,,,,
I had a few late assignments - but those were late due to me not understanding how to complete and needing help,,,,,,,,,,,,,,,
I had a fun time with this class and put my effort into it.,,,,,,,,,,,,,,,
Lab was great and I was engaged and ready for each class.,,,,,,,,,,,,,,,
turned in a few labs late because I couldnt figure them out well enough,,,,,,,,,,,,,,,
Class was meh.,,,,,,,,,,,,,,,
Nah i don't feel like it.,,,,,,,,,,,,,,,
Dr.Cotler gives clear deadlines to allow students to keep up with the work assigned. Class structure is organized well. ,,,,,,,,,,,,,,,
Honestly enjoyed the class a lot was new to the concept of computer science and coding. But this class made me feel comfortable with low level python and computer science,,,,,,,,,,,,,,,
Professor Chaudhari was an extremely passionate professor who was always there to help no matter the time. I would come in at 11pm some nights and he would be there willing to help me with a lab. There were a couple instances where I had personal matter that led to a late lab which counts as a zero but that part is not his fault. I really enjoyed my time with professor Chaudhari.,,,,,,,,,,,,,,,
I had some trouble keeping up with some of the course work,,,,,,,,,,,,,,,
"I had difficulty completing my assignments thus, I rarely felt confident enough to speak.",,,,,,,,,,,,,,,
I’m not the biggest in class person. Prefer to listen and absorb rather than take up time with my own voice. ,,,,,,,,,,,,,,,
8am lab is rough. Just the time slot not the professors fault.,,,,,,,,,,,,,,,
I lack the ability to show up 5minutes before.,,,,,,,,,,,,,,,
As stated.,,,,,,,,,,,,,,,
Yup.,,,,,,,,,,,,,,,
n/a,,,,,,,,,,,,,,,
There wasn't much class discussion as we were just working on excel stuff after a brief lecture.,,,,,,,,,,,,,,,
n/a,,,,,,,,,,,,,,,
N/A,,,,,,,,,,,,,,,
N/A,,,,,,,,,,,,,,,
"The class was fun to take. I know that it’s out of the professors’ control but I strongly believe that late work even a minute late shouldn’t be counted as a 0. While this is a college course everyone turns in late work every now and then, getting a 0 immediately makes people not want to even bother completing the work and then we get double penalized for it by getting sanctions for not doing it.",,,,,,,,,,,,,,,
course was not to hard or easy,,,,,,,,,,,,,,,
"Everything on canvas in the beginning of the semester was organized, but as the semester went on it feel off. When it was organized, it was easy to find what we did in class, and what was done and when. Not sure why it stoped",,,,,,,,,,,,,,,
NA,,,,,,,,,,,,,,,
"I made sure to show up to almost every lab and scheduled meetings. Even if I was sick, I still made an effort to go to meetings via zoom and only used zoom as a last resort and the team mainly met physically.",,,,,,,,,,,,,,,
N/A,,,,,,,,,,,,,,,
There is the ILA that has been troubling me a lot and I am glad that it has been pseudo delayed but this is definitely my fault (Specifically with the checkpoints).,,,,,,,,,,,,,,,
good class,,,,,,,,,,,,,,,
There were some days where I was feeling sick this semester and I was not able to complete the homework in time. It was upsetting because this course is not accommodating to a student having illnesses ,,,,,,,,,,,,,,,
Assignment due dates and deadlines were stated clearly,,,,,,,,,,,,,,,
"All assignments were completed prior before class, I could’ve taken more time to understand the textbook material",,,,,,,,,,,,,,,
this course is well designed and i understood how to do everything just by completing the checkpoints and homeworks,,,,,,,,,,,,,,,
"The work was manageable and fair. Though some assignments were difficult, it was because the topics took more time to understand. All in all, it was a fair amount of work.",,,,,,,,,,,,,,,
I would do assignments in class so they were done for the weekend ,,,,,,,,,,,,,,,
"I struggled with some health issues and it really affected my ability to be the student that I usually am, which was hard this semester. It haltered my ability to stay on top of work.",,,,,,,,,,,,,,,
Professor Chaudhari is a great professor who truly cares about his student's success. ,,,,,,,,,,,,,,,
Work was easy to finish before class.,,,,,,,,,,,,,,,
I was already ready in class with either my homework done or with the materials I would need.,,,,,,,,,,,,,,,
"This class was surprisingly enjoyable, which was mainly because of professor Chaudhari. I also enjoyed how every class was very procedural and felt sort of like a puzzle to solve.",,,,,,,,,,,,,,,
"I enjoyed the class and learning how to use excel. I feel as though I learned a lot, but I think that the midterm and final grades account for too much of our overall grade, and it is not a complete reflection of what we learned ",,,,,,,,,,,,,,,
He is very good!,,,,,,,,,,,,,,,
Always came ready to learn,,,,,,,,,,,,,,,
Love that you are available at any time,,,,,,,,,,,,,,,
I wish there was more conceptual teaching. Big picture style.,,,,,,,,,,,,,,,
N/A.,,,,,,,,,,,,,,,
N/A. This professor has so much passion for the subject.,,,,,,,,,,,,,,,
...,,,,,,,,,,,,,,,
Was a really good course. interested me in computer science. ,,,,,,,,,,,,,,,
"He assigned a lot of work but it was due at the start of the next lab, so pretty ok.",,,,,,,,,,,,,,,
"Prof. C had homework due once a week, usually on Mondays. Not too bad to keep up with.",,,,,,,,,,,,,,,
I came to labs on time and always had the lab submitted because we had a week,,,,,,,,,,,,,,,
I completed most assignments on time but I was granted extra time for some,,,,,,,,,,,,,,,
"I always did the labs on times, but I often am not fully awake by the time lab starts so my contribution would sometimes be absent if I was really tired",,,,,,,,,,,,,,,
"I had a few late assignments, but overall my work was well done.",,,,,,,,,,,,,,,
It was a good class,,,,,,,,,,,,,,,
Our professor was good at making sure people were prepared and he made us want to do the work.,,,,,,,,,,,,,,,
N/A,,,,,,,,,,,,,,,
I was prepared for each class and completed all of the assignments,,,,,,,,,,,,,,,
"I just am bad at it. Nothing against the professor, hes very nice.",,,,,,,,,,,,,,,
Labs took much longer than 2 hours and required a lot of outside work,,,,,,,,,,,,,,,
Lecture involved participation from everyone.,,,,,,,,,,,,,,,
I came prepared to each lab and got everything done that I needed.,,,,,,,,,,,,,,,
"I completed all assignments before they were due, although if there was any extra time given to turn in an assignment I took it. ",,,,,,,,,,,,,,,
Loved it,,,,,,,,,,,,,,,
Very good professor and very good class,,,,,,,,,,,,,,,
A really interesting class but it is tough. I feel like the assignments were hard and we were expected to do work that we only went over once. However Prof. C was always available to help and really made me understand. Exams were not bad since most of the work was exactly what was on the practice exams. ,,,,,,,,,,,,,,,
I just was too nervous to speak in class. I definitely felt many spaces where I could talk but public speaking scares me.,,,,,,,,,,,,,,,
"I liked the community of my lab, it felt easy to work with others which im not used to.",,,,,,,,,,,,,,,
I feel that I have performed strongly this semester in CSIS110. It was a class I looked forward to every day. I enjoyed the beginner friendly environment and work load. ,,,,,,,,,,,,,,,
Professor C always comes very prepared and optimistic each class,,,,,,,,,,,,,,,
I finish all my work that was needed to get done.,,,,,,,,,,,,,,,
I liked how the professor engaged with the class.,,,,,,,,,,,,,,,
"You are an excellent university . You’re able to explain complex and dense content in a simple and accessible way, presenting both the theoretical foundation and the practical labs very clearly",,,,,,,,,,,,,,,
"Most days, I came in with my assignments done. But even if I didn’t, and I was having trouble with one, Prof C was very helpful. He would help me with completing it if I asked for assistance. He also encourages class participation, and is very enthusiastic when people do, even if the answer is not the one he’s looking for.",,,,,,,,,,,,,,,
Question: Activities that enhanced learning,,,,,,,,,,,,,,,
"All of the labs were really well done. They led us through the content in an engaging way. Working with a lab partner was surprisingly fun, and it worked really well to mix it up for each lab and get a chance to work with lots of different people.",,,,,,,,,,,,,,,
Zybooks helps but at times its overwhelming with the amount of content is in it. ,,,,,,,,,,,,,,,
The homework’s laid a good base for what we were learning each week ,,,,,,,,,,,,,,,
The labs were excellent to help our group get together and work on our project for a longer period of time.,,,,,,,,,,,,,,,
Hands on. Most lecture style with slides I lose interest faster and learn less.,,,,,,,,,,,,,,,
Lab or practice,,,,,,,,,,,,,,,
prof c showing good resources to help with labs,,,,,,,,,,,,,,,
The labs exposing us to different resources.,,,,,,,,,,,,,,,
"Labs, as well as the work we would do on our projects",,,,,,,,,,,,,,,
Coding stuff.,,,,,,,,,,,,,,,
Lab,,,,,,,,,,,,,,,
Labs helped,,,,,,,,,,,,,,,
The packets from class helped a lot,,,,,,,,,,,,,,,
I enjoyed how the labs gave a crash course on a specific topic whether it be accessibility or front-end development. This set us up to discover more on our own and put it into practice with the Software Engineering projects. ,,,,,,,,,,,,,,,
"Reading articles and taking quizzes for the agile portion. Then for the programming portion, having access to learning courses to expand our knowledge of the respective technologies. ",,,,,,,,,,,,,,,
I enjoyed the collective classroom discussions and excercise activities we did in Lecture. ,,,,,,,,,,,,,,,
I liked how the Professors would give us a little intro to the lab before actually doing the work. This helps me frame the knowledge into perspective and ultimately have an easier time with the task. ,,,,,,,,,,,,,,,
"I liked the interactive excercises we did in the course, the videos as well. They both helped to illustrate the ideas core to the lecture for that day. ",,,,,,,,,,,,,,,
Professor C's enthusiasm and willingness to help!,,,,,,,,,,,,,,,
The capstone project with our team helped me learn scrum methodology.,,,,,,,,,,,,,,,
The labs taught me a lot. ,,,,,,,,,,,,,,,
The labs were incredibly useful,,,,,,,,,,,,,,,
The overall capstone project,,,,,,,,,,,,,,,
All lab materials were provided,,,,,,,,,,,,,,,
"Lectures, Activities, Class/home work, and the slides.",,,,,,,,,,,,,,,
The labs itself were most things I haven't learned yet so its nice to get a little intro into these things.,,,,,,,,,,,,,,,
Office hours ,,,,,,,,,,,,,,,
The documents with explanation of what functions there are and how to use them,,,,,,,,,,,,,,,
The small in class activities we would do towards the end of classes were helpful,,,,,,,,,,,,,,,
In class group activities using whiteboards.,,,,,,,,,,,,,,,
Lectures and labs for sure,,,,,,,,,,,,,,,
Working on the labs outside of class and being in my own really helped me understand the topics ,,,,,,,,,,,,,,,
"As annoying as the readings were, It helped a lot",,,,,,,,,,,,,,,
The explanations during the labs really helped,,,,,,,,,,,,,,,
The handouts. ,,,,,,,,,,,,,,,
In class practice,,,,,,,,,,,,,,,
Labs helped a lot. ,,,,,,,,,,,,,,,
Mainly the labs,,,,,,,,,,,,,,,
Activities like the marshmallow and paper airplane games showed me how to better navigate a sprint cycle.,,,,,,,,,,,,,,,
Lecture being about what we are going to do in the lab,,,,,,,,,,,,,,,
My educator videos,,,,,,,,,,,,,,,
Hands on activities were the best. ,,,,,,,,,,,,,,,
"Typically one on one conversations would provide the most help, but I also found the hands on activities in class to be beneficial ",,,,,,,,,,,,,,,
The zybooks and labs. ,,,,,,,,,,,,,,,
Zybooks and the resources provided by the professor.,,,,,,,,,,,,,,,
"Labs, printouts.",,,,,,,,,,,,,,,
The printouts of the notes.,,,,,,,,,,,,,,,
"Collaboration and psychological safety between classmates are always a big help. Additionally, I liked the Marshmallow Challenge and Tinker Toys activities.",,,,,,,,,,,,,,,
The in-class walk-throughs and/or step-by-step labs,,,,,,,,,,,,,,,
The in class work,,,,,,,,,,,,,,,
The lab work,,,,,,,,,,,,,,,
I didn't use the book but the notes and being in class was really helpful,,,,,,,,,,,,,,,
The lecture notes helped.,,,,,,,,,,,,,,,
The prelab activities were useful to learning the material. ,,,,,,,,,,,,,,,
n/a,,,,,,,,,,,,,,,
The interactive activities really helped me learn the material. ,,,,,,,,,,,,,,,
labs,,,,,,,,,,,,,,,
Labs and projects.,,,,,,,,,,,,,,,
The labs and the projects helped me learn the best.,,,,,,,,,,,,,,,
Just the fun stuff in class and nice slides,,,,,,,,,,,,,,,
Lecture,,,,,,,,,,,,,,,
"Lectures were full of information at all times, did make it hard to follow though during some lecture",,,,,,,,,,,,,,,
yes it has,,,,,,,,,,,,,,,
Zybooks ,,,,,,,,,,,,,,,
Zybooks,,,,,,,,,,,,,,,
MyEducator was very helpful ,,,,,,,,,,,,,,,
Talking with my group and using agile methodologies ,,,,,,,,,,,,,,,
The labs,,,,,,,,,,,,,,,
The lectures and practicing the ideas we learned in lab. Office hours definitely helped ,,,,,,,,,,,,,,,
Checkpoints,,,,,,,,,,,,,,,
The lectures during the week,,,,,,,,,,,,,,,
"The prelabs were some of the most helpful, they *usually* didnt take all that long to complete and you were able to take multiple attempts to fix your errors based on instant feedback. ",,,,,,,,,,,,,,,
In class labs and prelabs,,,,,,,,,,,,,,,
Labs,,,,,,,,,,,,,,,
"Textbook, guided homework. ",,,,,,,,,,,,,,,
The textbook,,,,,,,,,,,,,,,
Examples of how to use certain functions.,,,,,,,,,,,,,,,
The checkins from Dr. Cotler and Dr. Chaudhari really helped us out in getting us together.,,,,,,,,,,,,,,,
The lectures were simple and nice and I liked the demos done for them.,,,,,,,,,,,,,,,
"Zoom calls to direct us on what to do next, usage of read me's to instruct the student, and encouraging collaboration and teaching how to do it in the best way for one of the labs.",,,,,,,,,,,,,,,
Lectures,,,,,,,,,,,,,,,
"Interactive activities, lectures, labs, demonstrations, ",,,,,,,,,,,,,,,
everything we did helped,,,,,,,,,,,,,,,
hands on ,,,,,,,,,,,,,,,
The pre lab activities,,,,,,,,,,,,,,,
The Lab Checkpoints helped me to develop my skills and learn the course material.,,,,,,,,,,,,,,,
The test your skills and checkpoints and myeducator,,,,,,,,,,,,,,,
Any activity that involved practical application went great lengths to etch the material into memory. I found that working on the whiteboards was a great method of practice which initially surprised me.,,,,,,,,,,,,,,,
checkpoints and homework assignments,,,,,,,,,,,,,,,
Whiteboard visuals,,,,,,,,,,,,,,,
watching the videos that explained how to do something,,,,,,,,,,,,,,,
"Group activities helped me learn the best, although good reading materials to take home was always apreciated.",,,,,,,,,,,,,,,
"The in class labs helped me the most, because when I needed help the teacher was very clear and concise.",,,,,,,,,,,,,,,
Outside of class assignments,,,,,,,,,,,,,,,
The practice exams were the most helpful to succeeding on tests.,,,,,,,,,,,,,,,
The notes and in class activities ,,,,,,,,,,,,,,,
practice homework and textbook,,,,,,,,,,,,,,,
Office Hours ,,,,,,,,,,,,,,,
Class time was helpful to complete homework. ,,,,,,,,,,,,,,,
Office hours and the homework,,,,,,,,,,,,,,,
The labs made learning the work fun and was a hand on experience.,,,,,,,,,,,,,,,
I learned through the textbook and the professor for this course.,,,,,,,,,,,,,,,
The labs and activities in class.,,,,,,,,,,,,,,,
Practice assignments that tell you what you got wrong,,,,,,,,,,,,,,,
"MyEducator, office hours, tutor sessions",,,,,,,,,,,,,,,
The excel assignments ,,,,,,,,,,,,,,,
Class worksheets ,,,,,,,,,,,,,,,
Working with different people for labs ,,,,,,,,,,,,,,,
The class activities were fun like when we did figma.,,,,,,,,,,,,,,,
The figma lab and the small group assignments in lab,,,,,,,,,,,,,,,
Zybooks readings + availability outside of classroom to explain topics,,,,,,,,,,,,,,,
Labs and interactive activities with my group,,,,,,,,,,,,,,,
The test your skills and checkpoints each weeks. The book is also very helpful,,,,,,,,,,,,,,,
I enjoyed learning new softwares and languages. ,,,,,,,,,,,,,,,
We did not do any activities. We taught ourselves for the most part and during class time we were just working on assignments without ever getting a lecture before them so we would understand what was going on.,,,,,,,,,,,,,,,
When he coded along with ther class.,,,,,,,,,,,,,,,
The hands-on activities in lab.,,,,,,,,,,,,,,,
The lab assignments.,,,,,,,,,,,,,,,
The review/lesson at the beginning of class,,,,,,,,,,,,,,,
studying,,,,,,,,,,,,,,,
studying,,,,,,,,,,,,,,,
Office Hours.,,,,,,,,,,,,,,,
Labs and lectures and having 1 on 1 conversations with professor C,,,,,,,,,,,,,,,
The lab.,,,,,,,,,,,,,,,
The labs.,,,,,,,,,,,,,,,
Office hours chatting one on one was very helpful when I went in,,,,,,,,,,,,,,,
Working as pairs and co-coding,,,,,,,,,,,,,,,
Lab work,,,,,,,,,,,,,,,
"Practice is really important to learn this type of skill, so I found all the practice opportunities helpful",,,,,,,,,,,,,,,
"The labs In general, very well made very good at teaching us material",,,,,,,,,,,,,,,
"The lectures in general, having a visual way to understand the concepts was very helpful.",,,,,,,,,,,,,,,
Labs and homework,,,,,,,,,,,,,,,
Labs,,,,,,,,,,,,,,,
I think the videos provided in the textbook helped the most. ,,,,,,,,,,,,,,,
The labs and in class lectures,,,,,,,,,,,,,,,
The lectures and labs,,,,,,,,,,,,,,,
"Going slower on some units , kinda felt fast and like we knew already what to do",,,,,,,,,,,,,,,
Just being able to go over everything in class before we start the lab.,,,,,,,,,,,,,,,
Board work ,,,,,,,,,,,,,,,
The lectures before the inclass work,,,,,,,,,,,,,,,
The instruction + help in the lab is very helpful.,,,,,,,,,,,,,,,
The notes and office hours help,,,,,,,,,,,,,,,
The activities that helped me learn the most were the lessons and checkpoints.,,,,,,,,,,,,,,,
I liked the little activities and worksheet and posting the lecture slides was really helpful,,,,,,,,,,,,,,,
Hands on lessons,,,,,,,,,,,,,,,
Applying the code,,,,,,,,,,,,,,,
Partner work,,,,,,,,,,,,,,,
Pre Labs,,,,,,,,,,,,,,,
"In class activities, make some group actives. ",,,,,,,,,,,,,,,
The labs and meeting outside of class. Also the zybooks helped a lot.,,,,,,,,,,,,,,,
The small group in the lab made the teacher more accessible.,,,,,,,,,,,,,,,
In class explanations and teaching. The videos and notes in the homework assignments. Ability to go to office hours for more help. ,,,,,,,,,,,,,,,
Pre labs ,,,,,,,,,,,,,,,
ZyBooks were awesome,,,,,,,,,,,,,,,
"The labs were helpful, especially doing something multiple times for various assignments. It definitely helps the concept stick in your brain.",,,,,,,,,,,,,,,
Exercises within the notes packets.,,,,,,,,,,,,,,,
The labs themselves were very helpful in learning the material and Professor C walked around the room constantly to answer any questions!,,,,,,,,,,,,,,,
Definitely labs,,,,,,,,,,,,,,,
I learned best when I was coding in the labs.,,,,,,,,,,,,,,,
Labs ,,,,,,,,,,,,,,,
Slides,,,,,,,,,,,,,,,
The labs and slides,,,,,,,,,,,,,,,
Labs,,,,,,,,,,,,,,,
The labs,,,,,,,,,,,,,,,
The labs were helpful in learning new things and putting them into a hands on experience is better than just listening to how to do something,,,,,,,,,,,,,,,
Labs,,,,,,,,,,,,,,,
The class discussions that we had helped learn course material,,,,,,,,,,,,,,,
The labs and notes packets provided more than sufficient baseline material that could used for the students independent work. The content provided gave the students options for their homework and allowed them to be creative.,,,,,,,,,,,,,,,
All of the labs.,,,,,,,,,,,,,,,
"All of them, I enjoyed this class and learned a lot.",,,,,,,,,,,,,,,
I learned how to code in python and I learned how to build stronger team working skills,,,,,,,,,,,,,,,
The 15 minutes he spent explaining in the middle of lab ,,,,,,,,,,,,,,,
The slides being printed out for us to take notes on,,,,,,,,,,,,,,,
Being able to meet with my professor after class to explain any problems i'm having.,,,,,,,,,,,,,,,
The thing that helped me learn the course material the most is me meeting with my professor and going over things I don't understand. He explains the problems in great detail and explains the collusions to me in a way I can understand clearly.,,,,,,,,,,,,,,,
Active labs with partners,,,,,,,,,,,,,,,
The active labs and flexible office hours,,,,,,,,,,,,,,,
"The handouts he gives us really help, and the hand on activities we do in class really help me understand the material",,,,,,,,,,,,,,,
Doings hands on lab activities helped with learning the class material.,,,,,,,,,,,,,,,
Labs and Hands On materials helped with learning the course material.,,,,,,,,,,,,,,,
doing the in-class worksheets ,,,,,,,,,,,,,,,
The Labs,,,,,,,,,,,,,,,
Homework and lab work,,,,,,,,,,,,,,,
Having a physical note sheet I could write on,,,,,,,,,,,,,,,
Having the lecture slides as a note packet I could write on helped.,,,,,,,,,,,,,,,
Teamwork between students and the professors aid if we were lost. ,,,,,,,,,,,,,,,
The hands on approach during the labs and the explanation of handout papers aided in the learning of the course material. ,,,,,,,,,,,,,,,
I liked when we got to deconstruct the old PCs. It was helpful to actually see the concepts we talked about in front of me.,,,,,,,,,,,,,,,
The labs helped me understand the material better. I also found that doing class activities like opening up a computer to find certain parts was helpful. ,,,,,,,,,,,,,,,
"Worksheets, homeworks, office hours, labs ",,,,,,,,,,,,,,,
Question: Feedback on instruction quality,,,,,,,,,,,,,,,
