"Siena University",,,,,,,,,,,,,,,
 I think he has been the best professor with interacting with students that I've seen so far. Keep it up.,,,,,,,,,,,,,,,
He could take less time instructing at the beginning of class and more interacting with each student helping them on their individual problems.,,,,,,,,,,,,,,,
None,,,,,,,,,,,,,,,
"I dont know, with so many students, time spent one on one is limited",,,,,,,,,,,,,,,
Nothing,,,,,,,,,,,,,,,
Was very engaging,,,,,,,,,,,,,,,
N/A,,,,,,,,,,,,,,,
Nothing!,,,,,,,,,,,,,,,
Review the assignments that are due before the next at the end of the previous class. ,,,,,,,,,,,,,,,
"Nothing, he does a great job helping when we need it. ",,,,,,,,,,,,,,,
I do not know,,,,,,,,,,,,,,,
"While assisting/helping students, letting students speak about their ideas would make the conversation more interactive. Students might be going in a completely wrong direction but letting them put the idea infront would be beneficial for students cause the students would be doing that a lot when they go in the industry. We know you have abundance knowledge and you are trying to solve the problem quickly.",,,,,,,,,,,,,,,
Teach the topics before having students start working on the assignments ,,,,,,,,,,,,,,,
more coding with the class,,,,,,,,,,,,,,,
N/A. He is always encouraging students to come to his office hours and reach out if they need help.,,,,,,,,,,,,,,,
Nothing. He was always helping students and encouraging them to do this best work.,,,,,,,,,,,,,,,
Nothing,,,,,,,,,,,,,,,
NA,,,,,,,,,,,,,,,
Speak a little more slowly so he is easier to understand ,,,,,,,,,,,,,,,
"I feel that rather than leave students to almost learn the material in your own, he could explain more in class. ",,,,,,,,,,,,,,,
Not much,,,,,,,,,,,,,,,
Meet more through the week,,,,,,,,,,,,,,,
Was open to discussing problems,,,,,,,,,,,,,,,
Go over the lesson before assigned,,,,,,,,,,,,,,,
The instructor could check in with students through email to see if they have any questions or when they are in class.,,,,,,,,,,,,,,,
Nothing I can think of,,,,,,,,,,,,,,,
N/A,,,,,,,,,,,,,,,
"The instructor is very good at interacting with students, very friendly, no further notes.",,,,,,,,,,,,,,,
"The instructor was always quick to answer questions and help students go in the right direction without just giving the answer, no notes!",,,,,,,,,,,,,,,
Nothing he did very well!,,,,,,,,,,,,,,,
Interactions with students are very helpful.,,,,,,,,,,,,,,,
"Keep interacting with students in lab as even though they might not ask for help, there is a good chance they need it.",,,,,,,,,,,,,,,
"Every Excel professor's office hours was listed in the syllabus, but it was shoved in the middle. I would make this more visible so students don't have to skim through the entire syllabus to look for your professor's office hours.",,,,,,,,,,,,,,,
N/A,,,,,,,,,,,,,,,
"I liked how the semester went, i felt as it went on i found myself talking with alot of the students more throughout the labs and after lecture on their progress on projects and labs",,,,,,,,,,,,,,,
I think they both already do a great job working with students,,,,,,,,,,,,,,,
Question: What instructor did well,,,,,,,,,,,,,,,
"Showing us step by step what hes showing, instead of lecture style",,,,,,,,,,,,,,,
Very direct with concepts. Included topics relevant to modern situations in Software Engineering.,,,,,,,,,,,,,,,
Hands on lab.,,,,,,,,,,,,,,,
"I liked it when Professor C would do tutorials on what we were learning with us to ensure everyone knew what was going on. In addition, he was always available outside of class for any programming assistance our group needed. Much appreciated. ",,,,,,,,,,,,,,,
Professor. C includes helpful things and tools commonly used in software development during lectures,,,,,,,,,,,,,,,
He helped us a lot with our project and provided insight that we otherwise wouldn't have had. This made working on the project much smoother because whenever we had issues he was able to help despite not knowing everything about our project,,,,,,,,,,,,,,,
his feedback was incredibly useful,,,,,,,,,,,,,,,
Professor Chaudhari was very helpful in understanding how our framework worked.,,,,,,,,,,,,,,,
Very useful lectures and general help of software inquiries,,,,,,,,,,,,,,,
"He always kept us on track, kept us on pace, and was energetic enough to keep us on pace.",,,,,,,,,,,,,,,
Question: How instructor can improve course,,,,,,,,,,,,,,,
Provide a free textbook,,,,,,,,,,,,,,,
The class was good as is ,,,,,,,,,,,,,,,
n/a ,,,,,,,,,,,,,,,
Show students more resources they can use with their own code/ to help build their knowledge and coding skills,,,,,,,,,,,,,,,
The instructor did great as is.,,,,,,,,,,,,,,,
The instructor is doing well as is.,,,,,,,,,,,,,,,
Not sure.,,,,,,,,,,,,,,,
"Besides AWS and GitHub include talks about workplace etiquette as it pertains to software development, norms, or unwritten rules that are expected to be followed in such a position so that newly graduated students are not seen as noobs or make nooby mistakes when they enter into their first position. I personally have the experience of 3 internships and still make these mistakes, imagine a new grad with only 1!",,,,,,,,,,,,,,,
More activities in lecture. I loved all of our classroom activities. ,,,,,,,,,,,,,,,
More AI incorporated into the course? It is a trend after all and many people are interested in it!,,,,,,,,,,,,,,,
Go at a slower pace during labs.,,,,,,,,,,,,,,,
Sometimes material was hard to grasp in some lectures. Most python had to be taught on my own since basic information was covered but harder concepts were not covered,,,,,,,,,,,,,,,
I think the lab instructions can be concise and organized if they were in a google doc instead. ,,,,,,,,,,,,,,,
Less strict on some grading,,,,,,,,,,,,,,,
constantly listened to feedback and wasnt afraid to change how things were done mid-semester. If things didnt make sense they were open-minded and would work to fix it. Thats why this course is the best in the department,,,,,,,,,,,,,,,
Make instruction on labs a bit more clear. ,,,,,,,,,,,,,,,
Make instructions clearer,,,,,,,,,,,,,,,
Some of the labs were long and confusing. Maybe making them more structured and easy flowing.,,,,,,,,,,,,,,,
Great labs I can’t think of anything,,,,,,,,,,,,,,,
NO MORE ZYBOOKS,,,,,,,,,,,,,,,
More Python homeworks are good practice. Lower the percent of the homework grade. ,,,,,,,,,,,,,,,
Have the final project be more important and possibly replace the final exam,,,,,,,,,,,,,,,
I feel like we should be allowed to work by ourselves in lab,,,,,,,,,,,,,,,
"Make lecture 1hr, have lab more interactive rather than an extra lecture",,,,,,,,,,,,,,,
"I'm not sure really, nothing to change really.",,,,,,,,,,,,,,,
Nothing,,,,,,,,,,,,,,,
Time management for lectures and assignments (like the projects) so that everything can be covered.,,,,,,,,,,,,,,,
I feel like a lot of the topics were crammed in. I feel like if we spent more time on topics I would have a better understanding on things we have learned. I would rather have a good understanding in 2-3 topics rather than than having little knowledge on a lot of topics.,,,,,,,,,,,,,,,
Keep the topics the same but have it so we can finish the labs in class,,,,,,,,,,,,,,,
The instructor could spend more time explaining the material.,,,,,,,,,,,,,,,
Not much ,,,,,,,,,,,,,,,
Nothing I can think of.,,,,,,,,,,,,,,,
-,,,,,,,,,,,,,,,
N/A,,,,,,,,,,,,,,,
N/A,,,,,,,,,,,,,,,
Allow those who understand the work to begin the assignments instead of waiting until the review at the start of class is over. ,,,,,,,,,,,,,,,
more actually hands on work,,,,,,,,,,,,,,,
Slow down work at the end of semester to focus on the projects.,,,,,,,,,,,,,,,
The course load should slow down in the last 2 weeks. I felt as I had to do the regular amount of work plus doing a massive project. It was a bit too much. I would have rather focus on a good project than focus on getting all the work done. ,,,,,,,,,,,,,,,
"I felt as if towards the end of the semester the difficulty on the labs ramped up quite a bit really fast, found myself not being able to complete them in the time limit which in some cases is fine. But sometimes I’d still have a large chunk of work to do, and combined with other classes made it hard to find time to complete in good time",,,,,,,,,,,,,,,
In class lectures were fine,,,,,,,,,,,,,,,
Its good as is just needs better explanations in lab,,,,,,,,,,,,,,,
Lessen the amount of meat in the lectures and focus more on allowing the student to see or make there own examples to really lock in the material,,,,,,,,,,,,,,,
N/A,,,,,,,,,,,,,,,
N/A,,,,,,,,,,,,,,,
Nothing,,,,,,,,,,,,,,,
Nothing was very good,,,,,,,,,,,,,,,
nothing,,,,,,,,,,,,,,,
"I think it’s too hard, I’m not a CS major and most in my class are not. This is an introductory class and it will be my worst grade at Siena over 4 years",,,,,,,,,,,,,,,
"Have more individual grades, if theres a group that is being carried by one person that person should get a better grade than everyone else ",,,,,,,,,,,,,,,
"Not talk during the labs. During the labs, there should be no lectures",,,,,,,,,,,,,,,
N/A,,,,,,,,,,,,,,,
Go over topics at the beginning of class (lecture style),,,,,,,,,,,,,,,
Explained in other survey.,,,,,,,,,,,,,,,
Have the labs lead by Dr. Chaudhari and Dr. Cotler alternate between eachother maybe.,,,,,,,,,,,,,,,
just be more organized,,,,,,,,,,,,,,,
just be mroe organized,,,,,,,,,,,,,,,
nothing,,,,,,,,,,,,,,,
nothing,,,,,,,,,,,,,,,
Professor Chaudhari could better outline Boolean functions and if statement. This was a part of the curriculum that I found to be challenging. Overall he should be more accommodating to students because this is an introduction course and we are all new to the Excel application. ,,,,,,,,,,,,,,,
idk,,,,,,,,,,,,,,,
Nothing,,,,,,,,,,,,,,,
Nothing,,,,,,,,,,,,,,,
nothing,,,,,,,,,,,,,,,
Explain clearer,,,,,,,,,,,,,,,
Less homework ,,,,,,,,,,,,,,,
Have a more structured course journey,,,,,,,,,,,,,,,
More group work,,,,,,,,,,,,,,,
"This class was very polarizing, I mentioned it before in the class lecture evals, but the labs left me very disappointed. If we had more time I think I would have learned more in this class than any other class, but we sped through topics so fast. Docker, Selenium, Use Case Diagrams, etc each of them could be class on their own (maybe not use case diagrams but you know what I mean). In fact, I had a friend tell me how he used Docker in his real life job, and I would have loved to be more comfortable in it, but all we did was follow the instructions, download some stuff, and then move on. Again, this class was not bad, I am definitely happy that I took it, but there are a lot of improvements that can be made.",,,,,,,,,,,,,,,
Provide more notes,,,,,,,,,,,,,,,
"To improve the course, the instructor could make checkpoints and lab shorter so there is more time for questions and less of a need to stay for hours after the class. ",,,,,,,,,,,,,,,
Nothing.,,,,,,,,,,,,,,,
The work load was a lot for a 1 credit class but he did the best with what he had to work with.,,,,,,,,,,,,,,,
"My instructor could change the time that it takes place at, rather than 8 to 10, perhaps 10 to 12.",,,,,,,,,,,,,,,
more paper worksheets,,,,,,,,,,,,,,,
Checkpoints could be less time consuming or have more clear instructions later on,,,,,,,,,,,,,,,
Labs are too hectic sometimes,,,,,,,,,,,,,,,
"Labs can sometimes be very hectic, jumping from one thing to the next and can get confusing quickly.",,,,,,,,,,,,,,,
Maybe give us time to work on our sprints in lab and do the docker lab a bit sooner(this lab really helped for the WEL team),,,,,,,,,,,,,,,
Maybe have us work on our sprints in lab for maybe 1 lab or so,,,,,,,,,,,,,,,
N/A,,,,,,,,,,,,,,,
Be more authoritative in labs,,,,,,,,,,,,,,,
Do more review and teaching in class rather than only relying on the book,,,,,,,,,,,,,,,
I wish he would have taught the class more on the whiteboard and actually taken us step by step when learning new things. He did it a few times but I have heard of some friends who have teachers who actually teach a whole lesson in class about what they are doing. I think I would have learned the content of this class much easier if we were taught in this manner. ,,,,,,,,,,,,,,,
the same as above with the other entry,,,,,,,,,,,,,,,
"Instead of solving the problem, guiding the students to solve it would be much better collaborative work, I think.",,,,,,,,,,,,,,,
Spend time teaching the material ,,,,,,,,,,,,,,,
He may be able to work on paired programming with students. That was my biggest struggle this semester in lab.,,,,,,,,,,,,,,,
"It is difficult to improve a course like this, but if anything, maybe some more continuity between the content of the labs. I don't know if this would work, but if we could have one half of the lab be on learning how to apply the concepts, then the other half could be an full-stack cumulative website over the course of the semester.",,,,,,,,,,,,,,,
"The course is very difficult, and it is usually hard to complete all the material within the 2 hour time frame.",,,,,,,,,,,,,,,
nothing. he did a fantastic job,,,,,,,,,,,,,,,
NA,,,,,,,,,,,,,,,
I enjoyed the course and nothing specific comes to mind,,,,,,,,,,,,,,,
Maybe more focused/goal-oriented labs focusing on one thing with a clear purpose. Sometimes a lot of time was spent on trying to get something running that was not used again.,,,,,,,,,,,,,,,
Sometimes lab felt a little unfocused with learning about multiple totally different topics. Labs occasionally didn't feel the super productive.,,,,,,,,,,,,,,,
Not much,,,,,,,,,,,,,,,
Less homework more in class work,,,,,,,,,,,,,,,
Possibly give students more time,,,,,,,,,,,,,,,
Lessen the work load through out the week,,,,,,,,,,,,,,,
The instructor could give us two classes before the assignments are due so everyone understands the assignments and checkpoints more.,,,,,,,,,,,,,,,
Nothing I can think of ,,,,,,,,,,,,,,,
Go over different languages used in specific projects.,,,,,,,,,,,,,,,
N/A,,,,,,,,,,,,,,,
"I don't know if this is up to the instructor, but I believe this class might be better for a twice a week lecture that is 1 hour and 30 minutes long instead of a single 2 hour way. There were times where it was hard to enforce new information because all of the learning would occur every 7 days.",,,,,,,,,,,,,,,
"The instructor would sometimes go on long talks about adjacent material that did not pertain to the lab work, halting us from making lab progress. This meant we'd have to sometimes do 2+ hours of lab work on our own time when we should've been able to do it during lab.",,,,,,,,,,,,,,,
"I think that 1 time a week. The fact its also 1 credit is pretty dumb. I think students would do way better if it was 3 hrs a week and then students would be able to learn one class then have the Wednesday or Thursday class to go ask questions and get help and work with a friend in class or the professor, instead of struggling in the lab and RB for hours.",,,,,,,,,,,,,,,
Less tangents for slightly off topic discussions.,,,,,,,,,,,,,,,
Not a 8am lab but I know thats not his fault.,,,,,,,,,,,,,,,
N/A,,,,,,,,,,,,,,,
There’s a ton of long work that stacks up quickly ,,,,,,,,,,,,,,,
"Maybe make the lab instructions a little more clear, I enjoy the labs, but they are very time consuming, but help me understand the concept",,,,,,,,,,,,,,,
I did get lost in lab a few times. I felt like the pace was really fast and the explanations of certain things just blew by me since I was stuck figuring out the previous thing. ,,,,,,,,,,,,,,,
"I wish that the class met more than once a week. I found the direction of the course a bit hard to follow along with. Maybe it's because there was SO much information taught in this course, that it was a bit overwhelming for me. Maybe clearer directions/explanations on what each concept is/does would be more helpful. To be completely honest, I felt like the zybooks were just busy work, and I felt like I learned MUCH more from Ninad introducing and teaching us the concepts than from the zybooks. He told us not to copy and paste code, but then had code for us to copy and paste for certain assignments. This was confusing for me, but the "recipe book" analogy for code he gave does make sense. ",,,,,,,,,,,,,,,
For the love of god no more zybooks. It is boring and takes too long. there’s resources that are just as good like W3 schools,,,,,,,,,,,,,,,
Don't be late to lab so often,,,,,,,,,,,,,,,
"if possible, see if students can change labs around to get all the entire team together in the same lab",,,,,,,,,,,,,,,
Question: How to improve interactions with students,,,,,,,,,,,,,,,
N/A,,,,,,,,,,,,,,,
The instructor is doing well as is.,,,,,,,,,,,,,,,
Stop interupting us...,,,,,,,,,,,,,,,
Nothing. Professor C's interaction with students has improved since the beginning of the course. I feel much more comfortable approaching him for programming assistance or any in general. ,,,,,,,,,,,,,,,
I think having more in-class activities would help with this and make students be more engaged,,,,,,,,,,,,,,,
"nothing, it is good",,,,,,,,,,,,,,,
Sometimes the talking is a bit too fast but thats understandable since I talk too fast as well.,,,,,,,,,,,,,,,
Question: If student taught this class,,,,,,,,,,,,,,,
Use a textbook that cost less money,,,,,,,,,,,,,,,
Do it the way Prof. C did it,,,,,,,,,,,,,,,
Quit and tell the school to hire prof c,,,,,,,,,,,,,,,
Teach it as the instructor has taught it.,,,,,,,,,,,,,,,
Teach the class as the instructor has taught it.,,,,,,,,,,,,,,,
Not sure.,,,,,,,,,,,,,,,
Include more lectures on workplace/coding etiquette. ,,,,,,,,,,,,,,,
"Do the same thing both professors are currently doing, except go at a slower pace.",,,,,,,,,,,,,,,
Focus some more on python in lecture,,,,,,,,,,,,,,,
Improve lab instructions and have it on google docs instead.,,,,,,,,,,,,,,,
Make instructions clearer,,,,,,,,,,,,,,,
Make instructions on labs a bit clearer. ,,,,,,,,,,,,,,,
"Have fun, helping people on their labs and clearing up confusion is a awesome feeling",,,,,,,,,,,,,,,
Struggle. A lot of material was covered this semester and I would not know how to teach it all,,,,,,,,,,,,,,,
"Give a final python project instead of a final. Tests are not for everyone, and perhaps a project on repl can be a better determinant for the individuals grade. At the same time, more students would be influenced to understand the concepts in class.",,,,,,,,,,,,,,,
let students work by them selves or in groups in labs,,,,,,,,,,,,,,,
N / A,,,,,,,,,,,,,,,
Not change anything,,,,,,,,,,,,,,,
Not change anything.,,,,,,,,,,,,,,,
Spend more time breaking down code rather than showing it and moving forward to a more in depth topic,,,,,,,,,,,,,,,
Try to re-word my instructions if a student was having trouble and go through questions as a class.,,,,,,,,,,,,,,,
Do nothing different.,,,,,,,,,,,,,,,
Hope to have the same passion as my professor.,,,,,,,,,,,,,,,
-,,,,,,,,,,,,,,,
"do pretty much the same thing, perhaps the tiniest bit more tutorial work",,,,,,,,,,,,,,,
"Teach the majority of it the same way, perhaps lighten the load the tiniest bit. ",,,,,,,,,,,,,,,
Do the same as it were taught ,,,,,,,,,,,,,,,
Teach it the same as it was taught ,,,,,,,,,,,,,,,
Run it in a similar fashion but maybe make the lab checkpoints a little shorter.,,,,,,,,,,,,,,,
"Communicate to my students exactly what I want from them. Give examples of what specific things should look like, so I know how I am progressing on assignments. ",,,,,,,,,,,,,,,
Slow down work at the end of semester to focus on the projects.,,,,,,,,,,,,,,,
Keep doing the same thing,,,,,,,,,,,,,,,
Keep doing what is already being done,,,,,,,,,,,,,,,
"Same as before, give students more time to hone in on material",,,,,,,,,,,,,,,
Do it the same way ,,,,,,,,,,,,,,,
Do it the same way ,,,,,,,,,,,,,,,
be exactly like my professor,,,,,,,,,,,,,,,
stay the same,,,,,,,,,,,,,,,
Just take it easier,,,,,,,,,,,,,,,
Make the midterm shorter as it seemed a fair amount of people ran out of time.,,,,,,,,,,,,,,,
"Remove sanctions against uncompleted assignments, I understand the importance of finishing them but taking 3 points off a students final grade in addition to the points already lost doesn't help anybody. ",,,,,,,,,,,,,,,
Make less strict deadlines,,,,,,,,,,,,,,,
Less assignments per topic. ,,,,,,,,,,,,,,,
Prepare for the lab that's due the following week.,,,,,,,,,,,,,,,
Do the same.,,,,,,,,,,,,,,,
Same as other survey.,,,,,,,,,,,,,,,
nothing different,,,,,,,,,,,,,,,
teach it like he did,,,,,,,,,,,,,,,
teach it like him,,,,,,,,,,,,,,,
teach it pretty much the same,,,,,,,,,,,,,,,
Show the functions of excel for around a couple of minutes on the actual excel application as opposed to using a whiteboard. ,,,,,,,,,,,,,,,
try to be like my instructor,,,,,,,,,,,,,,,
Teach it just like Professor Chaudhari,,,,,,,,,,,,,,,
Do everything the professor did,,,,,,,,,,,,,,,
not do as good of a job as ninad,,,,,,,,,,,,,,,
Be patient ,,,,,,,,,,,,,,,
Have less homework and more practices,,,,,,,,,,,,,,,
Try to imitate Professor Chaudhari.,,,,,,,,,,,,,,,
"Change nothing. The course was great, probably the most useful course I have taken this semester.",,,,,,,,,,,,,,,
explain more before the lab,,,,,,,,,,,,,,,
Make checkpoints shorter to give students more time to ask questions. ,,,,,,,,,,,,,,,
give less assigments to do each week because each one takes a long time. ,,,,,,,,,,,,,,,
Do the exact same as he did.,,,,,,,,,,,,,,,
Bring the same energy and positivity. It goes a long way. At least with me it does.,,,,,,,,,,,,,,,
Try to be half as enthusiastic as professor chaudhari.,,,,,,,,,,,,,,,
Change checkpoints to be more clear,,,,,,,,,,,,,,,
Not change anything,,,,,,,,,,,,,,,
Not change anything ,,,,,,,,,,,,,,,
N/A,,,,,,,,,,,,,,,
keep it the same,,,,,,,,,,,,,,,
I would actually give lessons instead of just focusing on using the class time to get the assignments completed. ,,,,,,,,,,,,,,,
same as above,,,,,,,,,,,,,,,
Teach the material ,,,,,,,,,,,,,,,
give students more time to do the final project.,,,,,,,,,,,,,,,
want my own office space.,,,,,,,,,,,,,,,
Do very much the same,,,,,,,,,,,,,,,
Teach in a very similar manor to professor ,,,,,,,,,,,,,,,
Keep it the same,,,,,,,,,,,,,,,
Keep it up,,,,,,,,,,,,,,,
Try to encourage students to keep trying and feel comfortable making mistakes because it can be really difficult for some people,,,,,,,,,,,,,,,
"Try to keep labs a little more focused, concise, and goal driven.",,,,,,,,,,,,,,,
Try to make labs a bit more concise and goal oriented.,,,,,,,,,,,,,,,
Do what he does.,,,,,,,,,,,,,,,
Do what the current professor does,,,,,,,,,,,,,,,
do mostly everything the same as the professor but maybe give out notes so everyone has some notes for the final or for a midterm or test.,,,,,,,,,,,,,,,
I would not be as funny as Professor Chaudhari!,,,,,,,,,,,,,,,
Try to slow down when discussing more difficult topics or perhaps break up lessons into more consumable chunks.,,,,,,,,,,,,,,,
"Have 1 or 2 group tests just as a little grade bump because this class from what I noticed had lots of burn out half way through the semester, students just kept having a 2 hours hour class and 2-4 hours of homework.",,,,,,,,,,,,,,,
Ask him for help because I get nervous standing in front of people.,,,,,,,,,,,,,,,
Let him do it because I can't.,,,,,,,,,,,,,,,
Be the same way he is. Kind and helpful. He really cares about his students and that they do well.,,,,,,,,,,,,,,,
"Have the class at an earlier time in the day. I assumed the class was 6-8 because clients visit, but this only happened twice during the semester. If this is the reason a good alternative could be to just make this an evening class on those two days (pitch night & sprint 3 presentations) similar to what Prof. Matthews does with his exams in Discrete.",,,,,,,,,,,,,,,
Do nothing much different ,,,,,,,,,,,,,,,
Thank you Prof.Chaudhari!,,,,,,,,,,,,,,,
Talk less during labs,,,,,,,,,,,,,,,
do what they are doing,,,,,,,,,,,,,,,
Question: How instructor can improve course,,,,,,,,,,,,,,,
Keep it up,,,,,,,,,,,,,,,
The instructor is doing well as is.,,,,,,,,,,,,,,,
Did pretty good job teaching software engineering concepts,,,,,,,,,,,,,,,
"Maybe when we do the tutorial labs with architecture, front-end dev, back-end dev, etc, have more supplemental material to solidify the understanding of the topics. ",,,,,,,,,,,,,,,
Changing up the lecture style. I often found myself getting distracted because of the lecture format being just him talking. I think more engagement with students throughout the lectures is needed,,,,,,,,,,,,,,,
Make the presentations more understandable,,,,,,,,,,,,,,,
Teach about topics that are more engaging or interesting to students,,,,,,,,,,,,,,,
I guess the only improvement I can see if he is not doing it already is to incorporate some of the demos that Dr. Cotler does into his own lectures.,,,,,,,,,,,,,,,
Question: If student taught this class,,,,,,,,,,,,,,,
Be as enthusiastic as Prof C,,,,,,,,,,,,,,,
Teach it as the instructor has taught it.,,,,,,,,,,,,,,,
Not sure..,,,,,,,,,,,,,,,
Have more hands-on UX stuff rather than just lecturing about it.,,,,,,,,,,,,,,,
"Have a more concise and easier to follow, presentation",,,,,,,,,,,,,,,
Do what he does similar with the improvements shown.,,,,,,,,,,,,,,,
Question: How instructor can improve course,,,,,,,,,,,,,,,
Last lecture before final presentations should have focused on presentation prep,,,,,,,,,,,,,,,
Question: Feedback on instruction quality,,,,,,,,,,,,,,,
